{"schema_version":1,"format":"vsift.visual_index_record","index_id":"vix_fdae5304a4388b393ff51743af9e2d44","revision":1,"session_id":"ses_0123456789abcdef","source_id":"src_sha256_ac42e788ee8a00d4ccc80b73a06c6abd9390993d6ee7dff0c9d569da7b3566dc","stream_index":0,"displayed_dimensions":{"width":1280,"height":720},"duration_us":10000000,"profile":"r0-visual-v1","windows":[{"ordinal":0,"start_us":0,"end_us":10000000,"state":"analysed","sample_count":20,"dropped_candidates":0,"frameless_cells":[],"candidates":[{"id":"vcd_7b35427e018a3a29a2082645708666e5","reason":"first_frame","representative_us":0,"span_end_us":4500000,"sample_count":9,"stability":"settled","visual_hash":"3000382800000000","change":null},{"id":"vcd_83029130687cb6a9344ca9c755e17882","reason":"visual_change","representative_us":4500000,"span_end_us":5000000,"sample_count":1,"stability":"transient","visual_hash":"3000380e16000000","change":{"previous_sample_us":4000000,"changed_blocks":18,"max_block_delta":181}},{"id":"vcd_a39a711a4d7de48fee7ab40f7d592634","reason":"visual_change","representative_us":5000000,"span_end_us":10000000,"sample_count":10,"stability":"settled","visual_hash":"3000382800000000","change":{"previous_sample_us":4500000,"changed_blocks":18,"max_block_delta":181}}]}]}